{"type":"all","status":"passed","preservation":"verified","ran":2,"passed":2,"failed":0,"skipped":0,"failed_groups":[],"skipped_groups":[],"empty":0,"empty_groups":[],"executed":9,"js_skipped_reason":null,"blocked_reason":null,"subject_has_tests":true,"groups_with_tests":["Unit","Kernel"],"coverage":{"requested":false,"html":null,"percent":null},"filter":null,"recorded_at":"2026-10-04T12:58:15Z","subject_digest":"ceefd8a85adec84d76bb08828cdc29c2803971692f63bdd6499714b6abc6b689","git_head":"518f214ea8572359c4ef8f93daaa8af43b1f1af0","baseline":{"file":"@HOME@/Proyectos/drupilot-lab/m2/lm22/home/state/@HOMEKEY@_Proyectos_drupilot_lab_m2_lm22_dpl_m2_mig09_d11_web_modules_custom_legacy_widgets/test-baseline.json","source":"run","taken_at":"2026-10-04T12:51:58Z","type":"all","filter":null,"same_code":false,"regressions":[],"not_baselined":[],"pre_existing":[],"fixed":["Drupal\\Tests\\legacy_widgets\\Kernel\\LegacyWidgetsKernelTest::testQueueWorkerProcessesItem","Drupal\\Tests\\legacy_widgets\\Kernel\\LegacyWidgetsKernelTest::testFilterProducesSummary","Drupal\\Tests\\legacy_widgets\\Kernel\\LegacyWidgetsKernelTest::testEntityOperationWithDrupal10Arguments","Drupal\\Tests\\legacy_widgets\\Kernel\\LegacyWidgetsKernelTest::testCounterService","Drupal\\Tests\\legacy_widgets\\Kernel\\LegacyWidgetsKernelTest::testFindAccount"]},"negative_controls":null,"group_results":[{"group":"Unit","rc":0,"status":"passed","executed":4},{"group":"Kernel","rc":0,"status":"passed","executed":5}],"tests":[{"group":"Unit","id":"Drupal\\Tests\\legacy_widgets\\Unit\\WidgetCounterTest::testBucket with data set \"zero\"","status":"pass","message":null},{"group":"Unit","id":"Drupal\\Tests\\legacy_widgets\\Unit\\WidgetCounterTest::testBucket with data set \"below threshold\"","status":"pass","message":null},{"group":"Unit","id":"Drupal\\Tests\\legacy_widgets\\Unit\\WidgetCounterTest::testBucket with data set \"at threshold\"","status":"pass","message":null},{"group":"Unit","id":"Drupal\\Tests\\legacy_widgets\\Unit\\WidgetCounterTest::testBucket with data set \"above threshold\"","status":"pass","message":null},{"group":"Kernel","id":"Drupal\\Tests\\legacy_widgets\\Kernel\\LegacyWidgetsKernelTest::testQueueWorkerProcessesItem","status":"pass","message":null},{"group":"Kernel","id":"Drupal\\Tests\\legacy_widgets\\Kernel\\LegacyWidgetsKernelTest::testFilterProducesSummary","status":"pass","message":null},{"group":"Kernel","id":"Drupal\\Tests\\legacy_widgets\\Kernel\\LegacyWidgetsKernelTest::testEntityOperationWithDrupal10Arguments","status":"pass","message":null},{"group":"Kernel","id":"Drupal\\Tests\\legacy_widgets\\Kernel\\LegacyWidgetsKernelTest::testCounterService","status":"pass","message":null},{"group":"Kernel","id":"Drupal\\Tests\\legacy_widgets\\Kernel\\LegacyWidgetsKernelTest::testFindAccount","status":"pass","message":null}]}
